{"attempts":{},"disabled_reason":"bootstrap_required","enabled":false,"event_id":"replace-with-event-id","lifecycle_commit":"0000000000000000000000000000000000000000","memberships":{},"phase":"draft","quotas":{"maximum_attempts_per_team":0,"maximum_total_attempts":0,"reserved_by_team":{},"reserved_total":0},"results":{},"revision":0,"schema":"pythonhk.registry-state/v2","scoring":{"enabled":false,"isolation":"organizer-controlled","scorer_id":"","scorer_version":""},"teams":{},"users":{}}
